{
  "$schema": "http://json-schema.org/draft-04/schema#",
  "description": "courtscheduler.crown.search.and.book — CROWN search-and-book, single OR multi-day. Multi-day when durationInMinutes > 360 OR endDate is after hearingDate. courtScheduleId is an OPTIONAL anchor.",
  "type": "object",
  "properties": {
    "courtCentreId": { "type": "string" },
    "hearingDate": { "type": "string", "format": "date" },
    "endDate": { "type": "string", "format": "date" },
    "durationInMinutes": { "type": "integer" },
    "courtRoomId": { "type": "string" },
    "earliestHearingTime": { "type": "string" },
    "courtScheduleId": { "type": "string" },
    "source": { "type": "string", "enum": ["CROWN_FB_LIST", "CROWN_FB_ADJOURN", "CROWN_FB_UPDATE"] },
    "ouCode": { "type": "string", "description": "SPRDT-1283: centre ouCode so the single-day fallback can auto-create a session at a centre with no session to copy metadata from" },
    "courtCentreName": { "type": "string", "description": "SPRDT-1283: centre display name for the auto-created session" },
    "courtRoomName": { "type": "string", "description": "SPRDT-1283: room display name for the auto-created session" },
    "failOnNoAvailability": { "type": "boolean", "description": "SPRDT-1572: when true, a multi-day MOVE / fresh-book that finds no consecutive run returns 422 NO_AVAILABILITY instead of an empty sessions list" }
  },
  "required": ["courtCentreId", "hearingDate"],
  "additionalProperties": false
}
